{
  "package": "CONTACT-CODEC-01/mailbox-retained-read-v2",
  "decision": "DR-0104",
  "status": "FROZEN_TARGET_NOT_ACTIVE",
  "runtimeActivation": false,
  "newMagic": [],
  "suite": "0x0201",
  "requestMagic": "XMG2",
  "requestBytes": 435,
  "requestMaximumSeconds": 120,
  "resultMagic": "XMC2",
  "successBytes": 510,
  "grantMagic": "MCG3",
  "grantBytes": 304,
  "role": "Retrieve",
  "replicaCount": 2,
  "tupleBytes": 136,
  "tupleFields": [["requestHash",0,32],["locatorHash",32,32],["retrieveCapabilityDigest",64,32],["originalRouteHash",96,32],["readUntil",128,8]],
  "signingDomain": "Deep/ContactResolver/V2/mailbox-retained-read",
  "forwardingSigningDomain": "Deep/Registry/Internal/V2/mailbox-retained-read-authority",
  "forwardingFields": ["LP32(exactXMG2)","LP32(exactOriginalRoute)","readUntil:u64be","originalResponseDeadline:u64be","forwardingNodeId32","issuedAt:u64be","nonce32"],
  "capabilityDigestDomain": "Deep/ContactResolver/V1/grant-capability/retrieve",
  "objectHorizonMaximumSeconds": 2592000,
  "originalRouteOrder": ["XRR1","XRA1","XRC1","XSS1","PMT2","PMS2"],
  "originalRouteMaximumBytes": 23295,
  "retiredTranscriptCrossFeed": "reject current139-byte mailbox-grant-route transcript",
  "currentEvidenceStores": "exact current ContactResolve placement using XMG2 locator",
  "historicalProjection": "exact original PMT2 from current verified protected history",
  "issuer": "actual current PMA2 Retrieve role and generation floor",
  "grantExpiry": "minimum current NET/PMA2/role lifetime/readUntil",
  "grantSelection": "original exact PMT2/epoch/PMS2 selection and XRR1 placement",
  "currentDescriptorResolution": true,
  "storeAllowed": false,
  "rerankAllowed": false,
  "importUnprotectedAllowed": false,
  "legacyReader": false,
  "authorityEvidenceKind": 2,
  "privateReceiptKind": 7,
  "privateReadRpcOperation": 18
}
